[
  {
    "scenario_id": "fsrs-retrievability-reference-vectors",
    "mode": "retrievability",
    "cases": [
      {"s":1.0,"elapsed":0.0,"decay":-0.1542},
      {"s":1.0,"elapsed":1.0,"decay":-0.1542},
      {"s":1.0,"elapsed":7.0,"decay":-0.1542},
      {"s":1.0,"elapsed":30.0,"decay":-0.1542},
      {"s":1.0,"elapsed":100.0,"decay":-0.1542},
      {"s":1.0,"elapsed":365.0,"decay":-0.1542},
      {"s":1.0,"elapsed":1000.0,"decay":-0.1542},
      {"s":5.0,"elapsed":0.0,"decay":-0.1542},
      {"s":5.0,"elapsed":1.0,"decay":-0.1542},
      {"s":5.0,"elapsed":7.0,"decay":-0.1542},
      {"s":5.0,"elapsed":30.0,"decay":-0.1542},
      {"s":5.0,"elapsed":100.0,"decay":-0.1542},
      {"s":5.0,"elapsed":365.0,"decay":-0.1542},
      {"s":5.0,"elapsed":1000.0,"decay":-0.1542},
      {"s":10.0,"elapsed":0.0,"decay":-0.1542},
      {"s":10.0,"elapsed":1.0,"decay":-0.1542},
      {"s":10.0,"elapsed":7.0,"decay":-0.1542},
      {"s":10.0,"elapsed":30.0,"decay":-0.1542},
      {"s":10.0,"elapsed":100.0,"decay":-0.1542},
      {"s":10.0,"elapsed":365.0,"decay":-0.1542},
      {"s":10.0,"elapsed":1000.0,"decay":-0.1542},
      {"s":50.0,"elapsed":0.0,"decay":-0.1542},
      {"s":50.0,"elapsed":1.0,"decay":-0.1542},
      {"s":50.0,"elapsed":7.0,"decay":-0.1542},
      {"s":50.0,"elapsed":30.0,"decay":-0.1542},
      {"s":50.0,"elapsed":100.0,"decay":-0.1542},
      {"s":50.0,"elapsed":365.0,"decay":-0.1542},
      {"s":50.0,"elapsed":1000.0,"decay":-0.1542},
      {"s":200.0,"elapsed":0.0,"decay":-0.1542},
      {"s":200.0,"elapsed":1.0,"decay":-0.1542},
      {"s":200.0,"elapsed":7.0,"decay":-0.1542},
      {"s":200.0,"elapsed":30.0,"decay":-0.1542},
      {"s":200.0,"elapsed":100.0,"decay":-0.1542},
      {"s":200.0,"elapsed":365.0,"decay":-0.1542},
      {"s":200.0,"elapsed":1000.0,"decay":-0.1542},
      {"s":1000.0,"elapsed":0.0,"decay":-0.1542},
      {"s":1000.0,"elapsed":1.0,"decay":-0.1542},
      {"s":1000.0,"elapsed":7.0,"decay":-0.1542},
      {"s":1000.0,"elapsed":30.0,"decay":-0.1542},
      {"s":1000.0,"elapsed":100.0,"decay":-0.1542},
      {"s":1000.0,"elapsed":365.0,"decay":-0.1542},
      {"s":1000.0,"elapsed":1000.0,"decay":-0.1542},
      {"s":1.0,"elapsed":0.0,"decay":-0.1},
      {"s":1.0,"elapsed":1.0,"decay":-0.1},
      {"s":1.0,"elapsed":7.0,"decay":-0.1},
      {"s":1.0,"elapsed":30.0,"decay":-0.1},
      {"s":1.0,"elapsed":100.0,"decay":-0.1},
      {"s":1.0,"elapsed":365.0,"decay":-0.1},
      {"s":1.0,"elapsed":1000.0,"decay":-0.1},
      {"s":5.0,"elapsed":0.0,"decay":-0.1},
      {"s":5.0,"elapsed":1.0,"decay":-0.1},
      {"s":5.0,"elapsed":7.0,"decay":-0.1},
      {"s":5.0,"elapsed":30.0,"decay":-0.1},
      {"s":5.0,"elapsed":100.0,"decay":-0.1},
      {"s":5.0,"elapsed":365.0,"decay":-0.1},
      {"s":5.0,"elapsed":1000.0,"decay":-0.1},
      {"s":10.0,"elapsed":0.0,"decay":-0.1},
      {"s":10.0,"elapsed":1.0,"decay":-0.1},
      {"s":10.0,"elapsed":7.0,"decay":-0.1},
      {"s":10.0,"elapsed":30.0,"decay":-0.1},
      {"s":10.0,"elapsed":100.0,"decay":-0.1},
      {"s":10.0,"elapsed":365.0,"decay":-0.1},
      {"s":10.0,"elapsed":1000.0,"decay":-0.1},
      {"s":50.0,"elapsed":0.0,"decay":-0.1},
      {"s":50.0,"elapsed":1.0,"decay":-0.1},
      {"s":50.0,"elapsed":7.0,"decay":-0.1},
      {"s":50.0,"elapsed":30.0,"decay":-0.1},
      {"s":50.0,"elapsed":100.0,"decay":-0.1},
      {"s":50.0,"elapsed":365.0,"decay":-0.1},
      {"s":50.0,"elapsed":1000.0,"decay":-0.1},
      {"s":200.0,"elapsed":0.0,"decay":-0.1},
      {"s":200.0,"elapsed":1.0,"decay":-0.1},
      {"s":200.0,"elapsed":7.0,"decay":-0.1},
      {"s":200.0,"elapsed":30.0,"decay":-0.1},
      {"s":200.0,"elapsed":100.0,"decay":-0.1},
      {"s":200.0,"elapsed":365.0,"decay":-0.1},
      {"s":200.0,"elapsed":1000.0,"decay":-0.1},
      {"s":1000.0,"elapsed":0.0,"decay":-0.1},
      {"s":1000.0,"elapsed":1.0,"decay":-0.1},
      {"s":1000.0,"elapsed":7.0,"decay":-0.1},
      {"s":1000.0,"elapsed":30.0,"decay":-0.1},
      {"s":1000.0,"elapsed":100.0,"decay":-0.1},
      {"s":1000.0,"elapsed":365.0,"decay":-0.1},
      {"s":1000.0,"elapsed":1000.0,"decay":-0.1},
      {"s":1.0,"elapsed":0.0,"decay":-0.2},
      {"s":1.0,"elapsed":1.0,"decay":-0.2},
      {"s":1.0,"elapsed":7.0,"decay":-0.2},
      {"s":1.0,"elapsed":30.0,"decay":-0.2},
      {"s":1.0,"elapsed":100.0,"decay":-0.2},
      {"s":1.0,"elapsed":365.0,"decay":-0.2},
      {"s":1.0,"elapsed":1000.0,"decay":-0.2},
      {"s":5.0,"elapsed":0.0,"decay":-0.2},
      {"s":5.0,"elapsed":1.0,"decay":-0.2},
      {"s":5.0,"elapsed":7.0,"decay":-0.2},
      {"s":5.0,"elapsed":30.0,"decay":-0.2},
      {"s":5.0,"elapsed":100.0,"decay":-0.2},
      {"s":5.0,"elapsed":365.0,"decay":-0.2},
      {"s":5.0,"elapsed":1000.0,"decay":-0.2},
      {"s":10.0,"elapsed":0.0,"decay":-0.2},
      {"s":10.0,"elapsed":1.0,"decay":-0.2},
      {"s":10.0,"elapsed":7.0,"decay":-0.2},
      {"s":10.0,"elapsed":30.0,"decay":-0.2},
      {"s":10.0,"elapsed":100.0,"decay":-0.2},
      {"s":10.0,"elapsed":365.0,"decay":-0.2},
      {"s":10.0,"elapsed":1000.0,"decay":-0.2},
      {"s":50.0,"elapsed":0.0,"decay":-0.2},
      {"s":50.0,"elapsed":1.0,"decay":-0.2},
      {"s":50.0,"elapsed":7.0,"decay":-0.2},
      {"s":50.0,"elapsed":30.0,"decay":-0.2},
      {"s":50.0,"elapsed":100.0,"decay":-0.2},
      {"s":50.0,"elapsed":365.0,"decay":-0.2},
      {"s":50.0,"elapsed":1000.0,"decay":-0.2},
      {"s":200.0,"elapsed":0.0,"decay":-0.2},
      {"s":200.0,"elapsed":1.0,"decay":-0.2},
      {"s":200.0,"elapsed":7.0,"decay":-0.2},
      {"s":200.0,"elapsed":30.0,"decay":-0.2},
      {"s":200.0,"elapsed":100.0,"decay":-0.2},
      {"s":200.0,"elapsed":365.0,"decay":-0.2},
      {"s":200.0,"elapsed":1000.0,"decay":-0.2},
      {"s":1000.0,"elapsed":0.0,"decay":-0.2},
      {"s":1000.0,"elapsed":1.0,"decay":-0.2},
      {"s":1000.0,"elapsed":7.0,"decay":-0.2},
      {"s":1000.0,"elapsed":30.0,"decay":-0.2},
      {"s":1000.0,"elapsed":100.0,"decay":-0.2},
      {"s":1000.0,"elapsed":365.0,"decay":-0.2},
      {"s":1000.0,"elapsed":1000.0,"decay":-0.2},
      {"s":1.0,"elapsed":0.0,"decay":-0.5},
      {"s":1.0,"elapsed":1.0,"decay":-0.5},
      {"s":1.0,"elapsed":7.0,"decay":-0.5},
      {"s":1.0,"elapsed":30.0,"decay":-0.5},
      {"s":1.0,"elapsed":100.0,"decay":-0.5},
      {"s":1.0,"elapsed":365.0,"decay":-0.5},
      {"s":1.0,"elapsed":1000.0,"decay":-0.5},
      {"s":5.0,"elapsed":0.0,"decay":-0.5},
      {"s":5.0,"elapsed":1.0,"decay":-0.5},
      {"s":5.0,"elapsed":7.0,"decay":-0.5},
      {"s":5.0,"elapsed":30.0,"decay":-0.5},
      {"s":5.0,"elapsed":100.0,"decay":-0.5},
      {"s":5.0,"elapsed":365.0,"decay":-0.5},
      {"s":5.0,"elapsed":1000.0,"decay":-0.5},
      {"s":10.0,"elapsed":0.0,"decay":-0.5},
      {"s":10.0,"elapsed":1.0,"decay":-0.5},
      {"s":10.0,"elapsed":7.0,"decay":-0.5},
      {"s":10.0,"elapsed":30.0,"decay":-0.5},
      {"s":10.0,"elapsed":100.0,"decay":-0.5},
      {"s":10.0,"elapsed":365.0,"decay":-0.5},
      {"s":10.0,"elapsed":1000.0,"decay":-0.5},
      {"s":50.0,"elapsed":0.0,"decay":-0.5},
      {"s":50.0,"elapsed":1.0,"decay":-0.5},
      {"s":50.0,"elapsed":7.0,"decay":-0.5},
      {"s":50.0,"elapsed":30.0,"decay":-0.5},
      {"s":50.0,"elapsed":100.0,"decay":-0.5},
      {"s":50.0,"elapsed":365.0,"decay":-0.5},
      {"s":50.0,"elapsed":1000.0,"decay":-0.5},
      {"s":200.0,"elapsed":0.0,"decay":-0.5},
      {"s":200.0,"elapsed":1.0,"decay":-0.5},
      {"s":200.0,"elapsed":7.0,"decay":-0.5},
      {"s":200.0,"elapsed":30.0,"decay":-0.5},
      {"s":200.0,"elapsed":100.0,"decay":-0.5},
      {"s":200.0,"elapsed":365.0,"decay":-0.5},
      {"s":200.0,"elapsed":1000.0,"decay":-0.5},
      {"s":1000.0,"elapsed":0.0,"decay":-0.5},
      {"s":1000.0,"elapsed":1.0,"decay":-0.5},
      {"s":1000.0,"elapsed":7.0,"decay":-0.5},
      {"s":1000.0,"elapsed":30.0,"decay":-0.5},
      {"s":1000.0,"elapsed":100.0,"decay":-0.5},
      {"s":1000.0,"elapsed":365.0,"decay":-0.5},
      {"s":1000.0,"elapsed":1000.0,"decay":-0.5},
      {"s":0,"elapsed":10,"decay":-0.1542},
      {"s":-5,"elapsed":10,"decay":-0.1542},
      {"s":null,"elapsed":10,"decay":-0.1542},
      {"s":10,"elapsed":-1,"decay":-0.1542}
    ],